{"schema_version":"1.0","event_id":"event-2","run_id":"run-1","task_id":"task-1","sequence":2,"timestamp":"2026-09-18T00:00:00Z","type":"gate.finished","source":{"component":"test","version":"1"},"payload":{"schema_version":"1.0","gate_id":"gate-1","run_id":"run-1","category":"test","required":true,"status":"pass","reason_code":"ok","duration_seconds":0,"exit_code":0,"evidence_refs":[],"checker_version":"1","input_digest":"aaaaaaaaaaaaaaaaaaaaaaaaaaaaaaaaaaaaaaaaaaaaaaaaaaaaaaaaaaaaaaaa"},"artifact_refs":["artifact://event/2"]}
